<?xml version="1.0" standalone="yes"?>
<!--
Copyright (C) 1991-2012 Altera Corporation
Your use of Altera Corporation's design tools, logic functions 
and other software and tools, and its AMPP partner logic 
functions, and any output files from any of the foregoing 
(including device programming or simulation files), and any 
associated documentation or information are expressly subject 
to the terms and conditions of the Altera Program License 
Subscription Agreement, Altera MegaCore Function License 
Agreement, or other applicable license agreement, including, 
without limitation, that your use is for the sole purpose of 
programming logic devices manufactured by Altera and sold by 
Altera or its authorized distributors.  Please refer to the 
applicable agreement for further details.

Symbol generated by Quartus II 64-Bit
Version 12.1 Build 243 01/31/2013 Service Pack 1 SJ Web Edition
on 04/22/2015 12:36:16
-->
<!DOCTYPE PART_RECORD [<!ELEMENT PART_RECORD (MFRS|PARAMETERS|PINOUT_LABELS|DATA_SHEET)*>
<!ATTLIST PART_RECORD PART_NUMBER CDATA #IMPLIED>
<!ATTLIST PART_RECORD PART_DESCRIPT CDATA #IMPLIED>
<!ELEMENT MFRS (MFR)*>
<!ELEMENT MFR EMPTY>
<!ATTLIST MFR NAME CDATA #IMPLIED>
<!ATTLIST MFR STATUS CDATA #IMPLIED>
<!ELEMENT PARAMETERS (PARAMETER)*>
<!ELEMENT PARAMETER EMPTY>
<!ATTLIST PARAMETER NAME CDATA #IMPLIED>
<!ATTLIST PARAMETER VALUE CDATA #IMPLIED>
<!ELEMENT PINOUT_LABELS (PIN*)>
<!ATTLIST PINOUT_LABELS TYPE CDATA #IMPLIED>
<!ELEMENT PIN EMPTY>
<!ATTLIST PIN PIN_NUM CDATA #IMPLIED>
<!ATTLIST PIN FUNCTION CDATA #IMPLIED>
<!ATTLIST PIN SIGNAL CDATA #IMPLIED>
<!ATTLIST PIN IO CDATA #IMPLIED>
<!ATTLIST PIN CONTROL CDATA #IMPLIED>
<!ATTLIST PIN POLARITY CDATA #IMPLIED>
<!ELEMENT DATA_SHEET (IMAGE)*>
<!ELEMENT IMAGE EMPTY>
<!ATTLIST IMAGE IMAGE_DATE CDATA #IMPLIED>
<!ATTLIST IMAGE MFR_NAME CDATA #IMPLIED>
<!ATTLIST IMAGE xml:LINK CDATA #IMPLIED>
<!ATTLIST IMAGE ACTUATE CDATA #IMPLIED>
<!ATTLIST IMAGE HREF CDATA #IMPLIED> ]>
<PART_RECORD PART_NUMBER="EP2C50F484C6" PART_DESCRIPT="Programmable Logic Device (PLD)">
<MFRS>
<MFR NAME="Altera Corp" STATUS="Preliminary"/>
</MFRS>
<PARAMETERS>
<PARAMETER NAME="Technology" VALUE="CMOS"/>
<PARAMETER NAME="Family Name" VALUE="Cyclone II"/>
</PARAMETERS>
<PINOUT_LABELS TYPE="EXTENDED">
<PIN PIN_NUM="F5" FUNCTION="" SIGNAL="NC" IO="IN" CONTROL="DATA" POLARITY="P"/>
<PIN PIN_NUM="E5" FUNCTION="" SIGNAL="NC" IO="IN" CONTROL="DATA" POLARITY="P"/>
<PIN PIN_NUM="F6" FUNCTION="" SIGNAL="NC" IO="IN" CONTROL="DATA" POLARITY="P"/>
<PIN PIN_NUM="C4" FUNCTION="~ASDO~" SIGNAL="DIG" IO="IN" CONTROL="DATA" POLARITY="P"/>
<PIN PIN_NUM="C3" FUNCTION="~nCSO~" SIGNAL="DIG" IO="IN" CONTROL="DATA" POLARITY="P"/>
<PIN PIN_NUM="D3" FUNCTION="outp95" SIGNAL="DIG" IO="OUT" CONTROL="DATA" POLARITY="P"/>
<PIN PIN_NUM="D4" FUNCTION="outp100" SIGNAL="DIG" IO="OUT" CONTROL="DATA" POLARITY="P"/>
<PIN PIN_NUM="D5" FUNCTION="outp122" SIGNAL="DIG" IO="OUT" CONTROL="DATA" POLARITY="P"/>
<PIN PIN_NUM="D6" FUNCTION="outp125" SIGNAL="DIG" IO="OUT" CONTROL="DATA" POLARITY="P"/>
<PIN PIN_NUM="E3" FUNCTION="outp123" SIGNAL="DIG" IO="OUT" CONTROL="DATA" POLARITY="P"/>
<PIN PIN_NUM="E4" FUNCTION="outp115" SIGNAL="DIG" IO="OUT" CONTROL="DATA" POLARITY="P"/>
<PIN PIN_NUM="C1" FUNCTION="outp105" SIGNAL="DIG" IO="OUT" CONTROL="DATA" POLARITY="P"/>
<PIN PIN_NUM="C2" FUNCTION="outp127" SIGNAL="DIG" IO="OUT" CONTROL="DATA" POLARITY="P"/>
<PIN PIN_NUM="F4" FUNCTION="outp124" SIGNAL="DIG" IO="OUT" CONTROL="DATA" POLARITY="P"/>
<PIN PIN_NUM="G6" FUNCTION="stateModExpSub0" SIGNAL="DIG" IO="OUT" CONTROL="DATA" POLARITY="P"/>
<PIN PIN_NUM="G5" FUNCTION="stateModExp0" SIGNAL="DIG" IO="OUT" CONTROL="DATA" POLARITY="P"/>
<PIN PIN_NUM="F3" FUNCTION="outp114" SIGNAL="DIG" IO="OUT" CONTROL="DATA" POLARITY="P"/>
<PIN PIN_NUM="D1" FUNCTION="outp120" SIGNAL="DIG" IO="OUT" CONTROL="DATA" POLARITY="P"/>
<PIN PIN_NUM="D2" FUNCTION="outp121" SIGNAL="DIG" IO="OUT" CONTROL="DATA" POLARITY="P"/>
<PIN PIN_NUM="G3" FUNCTION="outp3" SIGNAL="DIG" IO="OUT" CONTROL="DATA" POLARITY="P"/>
<PIN PIN_NUM="H4" FUNCTION="outp107" SIGNAL="DIG" IO="OUT" CONTROL="DATA" POLARITY="P"/>
<PIN PIN_NUM="H5" FUNCTION="outp28" SIGNAL="DIG" IO="OUT" CONTROL="DATA" POLARITY="P"/>
<PIN PIN_NUM="H6" FUNCTION="outp118" SIGNAL="DIG" IO="OUT" CONTROL="DATA" POLARITY="P"/>
<PIN PIN_NUM="E1" FUNCTION="outp103" SIGNAL="DIG" IO="OUT" CONTROL="DATA" POLARITY="P"/>
<PIN PIN_NUM="E2" FUNCTION="outp109" SIGNAL="DIG" IO="OUT" CONTROL="DATA" POLARITY="P"/>
<PIN PIN_NUM="F1" FUNCTION="outp110" SIGNAL="DIG" IO="OUT" CONTROL="DATA" POLARITY="P"/>
<PIN PIN_NUM="F2" FUNCTION="outp2" SIGNAL="DIG" IO="OUT" CONTROL="DATA" POLARITY="P"/>
<PIN PIN_NUM="H3" FUNCTION="outp13" SIGNAL="DIG" IO="OUT" CONTROL="DATA" POLARITY="P"/>
<PIN PIN_NUM="G1" FUNCTION="outp11" SIGNAL="DIG" IO="OUT" CONTROL="DATA" POLARITY="P"/>
<PIN PIN_NUM="G2" FUNCTION="outp15" SIGNAL="DIG" IO="OUT" CONTROL="DATA" POLARITY="P"/>
<PIN PIN_NUM="J6" FUNCTION="outp119" SIGNAL="DIG" IO="OUT" CONTROL="DATA" POLARITY="P"/>
<PIN PIN_NUM="J5" FUNCTION="outp82" SIGNAL="DIG" IO="OUT" CONTROL="DATA" POLARITY="P"/>
<PIN PIN_NUM="H1" FUNCTION="stateModExp3" SIGNAL="DIG" IO="OUT" CONTROL="DATA" POLARITY="P"/>
<PIN PIN_NUM="H2" FUNCTION="stateModExpSub1" SIGNAL="DIG" IO="OUT" CONTROL="DATA" POLARITY="P"/>
<PIN PIN_NUM="J3" FUNCTION="stateModExpSub2" SIGNAL="DIG" IO="OUT" CONTROL="DATA" POLARITY="P"/>
<PIN PIN_NUM="J4" FUNCTION="outp6" SIGNAL="DIG" IO="OUT" CONTROL="DATA" POLARITY="P"/>
<PIN PIN_NUM="J1" FUNCTION="outp1" SIGNAL="DIG" IO="OUT" CONTROL="DATA" POLARITY="P"/>
<PIN PIN_NUM="J2" FUNCTION="outp5" SIGNAL="DIG" IO="OUT" CONTROL="DATA" POLARITY="P"/>
<PIN PIN_NUM="K5" FUNCTION="TDI" SIGNAL="DIG" IO="IN" CONTROL="CNTL" POLARITY="P"/>
<PIN PIN_NUM="K2" FUNCTION="TCK" SIGNAL="DIG" IO="IN" CONTROL="CNTL" POLARITY="P"/>
<PIN PIN_NUM="K6" FUNCTION="TMS" SIGNAL="DIG" IO="IN" CONTROL="CNTL" POLARITY="P"/>
<PIN PIN_NUM="L5" FUNCTION="TDO" SIGNAL="DIG" IO="IN" CONTROL="CNTL" POLARITY="P"/>
<PIN PIN_NUM="L6" FUNCTION="DCLK" SIGNAL="DIG" IO="IN" CONTROL="CNTL" POLARITY="P"/>
<PIN PIN_NUM="K4" FUNCTION="DATA0" SIGNAL="DIG" IO="IN" CONTROL="CNTL" POLARITY="P"/>
<PIN PIN_NUM="K1" FUNCTION="nCE" SIGNAL="DIG" IO="IN" CONTROL="CNTL" POLARITY="P"/>
<PIN PIN_NUM="L1" FUNCTION="" SIGNAL="NC" IO="IN" CONTROL="DATA" POLARITY="P"/>
<PIN PIN_NUM="L2" FUNCTION="" SIGNAL="NC" IO="IN" CONTROL="DATA" POLARITY="P"/>
<PIN PIN_NUM="L4" FUNCTION="nCONFIG" SIGNAL="DIG" IO="IN" CONTROL="CNTL" POLARITY="P"/>
<PIN PIN_NUM="M1" FUNCTION="clk" SIGNAL="DIG" IO="IN" CONTROL="DATA" POLARITY="P"/>
<PIN PIN_NUM="M2" FUNCTION="reset" SIGNAL="DIG" IO="IN" CONTROL="DATA" POLARITY="P"/>
<PIN PIN_NUM="M5" FUNCTION="inp60" SIGNAL="DIG" IO="IN" CONTROL="DATA" POLARITY="P"/>
<PIN PIN_NUM="M6" FUNCTION="inp69" SIGNAL="DIG" IO="IN" CONTROL="DATA" POLARITY="P"/>
<PIN PIN_NUM="N1" FUNCTION="inp66" SIGNAL="DIG" IO="IN" CONTROL="DATA" POLARITY="P"/>
<PIN PIN_NUM="N2" FUNCTION="inp52" SIGNAL="DIG" IO="IN" CONTROL="DATA" POLARITY="P"/>
<PIN PIN_NUM="P1" FUNCTION="inp100" SIGNAL="DIG" IO="IN" CONTROL="DATA" POLARITY="P"/>
<PIN PIN_NUM="P2" FUNCTION="inp94" SIGNAL="DIG" IO="IN" CONTROL="DATA" POLARITY="P"/>
<PIN PIN_NUM="N6" FUNCTION="inp8" SIGNAL="DIG" IO="IN" CONTROL="DATA" POLARITY="P"/>
<PIN PIN_NUM="N5" FUNCTION="inp1" SIGNAL="DIG" IO="IN" CONTROL="DATA" POLARITY="P"/>
<PIN PIN_NUM="N3" FUNCTION="inp120" SIGNAL="DIG" IO="IN" CONTROL="DATA" POLARITY="P"/>
<PIN PIN_NUM="N4" FUNCTION="inp121" SIGNAL="DIG" IO="IN" CONTROL="DATA" POLARITY="P"/>
<PIN PIN_NUM="P3" FUNCTION="inp119" SIGNAL="DIG" IO="IN" CONTROL="DATA" POLARITY="P"/>
<PIN PIN_NUM="P5" FUNCTION="stateModExp2" SIGNAL="DIG" IO="OUT" CONTROL="DATA" POLARITY="P"/>
<PIN PIN_NUM="P6" FUNCTION="startCompute" SIGNAL="DIG" IO="IN" CONTROL="DATA" POLARITY="P"/>
<PIN PIN_NUM="R1" FUNCTION="inp6" SIGNAL="DIG" IO="IN" CONTROL="DATA" POLARITY="P"/>
<PIN PIN_NUM="R2" FUNCTION="inp108" SIGNAL="DIG" IO="IN" CONTROL="DATA" POLARITY="P"/>
<PIN PIN_NUM="T1" FUNCTION="stateModExp1" SIGNAL="DIG" IO="OUT" CONTROL="DATA" POLARITY="P"/>
<PIN PIN_NUM="T2" FUNCTION="inp88" SIGNAL="DIG" IO="IN" CONTROL="DATA" POLARITY="P"/>
<PIN PIN_NUM="P4" FUNCTION="inp9" SIGNAL="DIG" IO="IN" CONTROL="DATA" POLARITY="P"/>
<PIN PIN_NUM="R4" FUNCTION="inp99" SIGNAL="DIG" IO="IN" CONTROL="DATA" POLARITY="P"/>
<PIN PIN_NUM="U1" FUNCTION="inp4" SIGNAL="DIG" IO="IN" CONTROL="DATA" POLARITY="P"/>
<PIN PIN_NUM="U2" FUNCTION="inp112" SIGNAL="DIG" IO="IN" CONTROL="DATA" POLARITY="P"/>
<PIN PIN_NUM="R5" FUNCTION="inp116" SIGNAL="DIG" IO="IN" CONTROL="DATA" POLARITY="P"/>
<PIN PIN_NUM="R6" FUNCTION="inp115" SIGNAL="DIG" IO="IN" CONTROL="DATA" POLARITY="P"/>
<PIN PIN_NUM="V1" FUNCTION="outp113" SIGNAL="DIG" IO="OUT" CONTROL="DATA" POLARITY="P"/>
<PIN PIN_NUM="V2" FUNCTION="startInput" SIGNAL="DIG" IO="IN" CONTROL="DATA" POLARITY="P"/>
<PIN PIN_NUM="T5" FUNCTION="getResult" SIGNAL="DIG" IO="IN" CONTROL="DATA" POLARITY="P"/>
<PIN PIN_NUM="T6" FUNCTION="outp4" SIGNAL="DIG" IO="OUT" CONTROL="DATA" POLARITY="P"/>
<PIN PIN_NUM="T3" FUNCTION="inp7" SIGNAL="DIG" IO="IN" CONTROL="DATA" POLARITY="P"/>
<PIN PIN_NUM="U3" FUNCTION="inp2" SIGNAL="DIG" IO="IN" CONTROL="DATA" POLARITY="P"/>
<PIN PIN_NUM="W1" FUNCTION="inp101" SIGNAL="DIG" IO="IN" CONTROL="DATA" POLARITY="P"/>
<PIN PIN_NUM="W2" FUNCTION="inp125" SIGNAL="DIG" IO="IN" CONTROL="DATA" POLARITY="P"/>
<PIN PIN_NUM="Y1" FUNCTION="inp105" SIGNAL="DIG" IO="IN" CONTROL="DATA" POLARITY="P"/>
<PIN PIN_NUM="Y2" FUNCTION="outp96" SIGNAL="DIG" IO="OUT" CONTROL="DATA" POLARITY="P"/>
<PIN PIN_NUM="W3" FUNCTION="inp102" SIGNAL="DIG" IO="IN" CONTROL="DATA" POLARITY="P"/>
<PIN PIN_NUM="W4" FUNCTION="outp108" SIGNAL="DIG" IO="OUT" CONTROL="DATA" POLARITY="P"/>
<PIN PIN_NUM="Y3" FUNCTION="outp111" SIGNAL="DIG" IO="OUT" CONTROL="DATA" POLARITY="P"/>
<PIN PIN_NUM="Y4" FUNCTION="inp127" SIGNAL="DIG" IO="IN" CONTROL="DATA" POLARITY="P"/>
<PIN PIN_NUM="W5" FUNCTION="outp7" SIGNAL="DIG" IO="OUT" CONTROL="DATA" POLARITY="P"/>
<PIN PIN_NUM="U4" FUNCTION="outp16" SIGNAL="DIG" IO="OUT" CONTROL="DATA" POLARITY="P"/>
<PIN PIN_NUM="V4" FUNCTION="outp126" SIGNAL="DIG" IO="OUT" CONTROL="DATA" POLARITY="P"/>
<PIN PIN_NUM="U5" FUNCTION="" SIGNAL="NC" IO="IN" CONTROL="DATA" POLARITY="P"/>
<PIN PIN_NUM="U6" FUNCTION="" SIGNAL="NC" IO="IN" CONTROL="DATA" POLARITY="P"/>
<PIN PIN_NUM="V5" FUNCTION="" SIGNAL="NC" IO="IN" CONTROL="DATA" POLARITY="P"/>
<PIN PIN_NUM="U7" FUNCTION="" SIGNAL="NC" IO="IN" CONTROL="DATA" POLARITY="P"/>
<PIN PIN_NUM="V7" FUNCTION="" SIGNAL="NC" IO="IN" CONTROL="DATA" POLARITY="P"/>
<PIN PIN_NUM="AA3" FUNCTION="outp99" SIGNAL="DIG" IO="OUT" CONTROL="DATA" POLARITY="P"/>
<PIN PIN_NUM="AB3" FUNCTION="outp106" SIGNAL="DIG" IO="OUT" CONTROL="DATA" POLARITY="P"/>
<PIN PIN_NUM="AB4" FUNCTION="outp116" SIGNAL="DIG" IO="OUT" CONTROL="DATA" POLARITY="P"/>
<PIN PIN_NUM="AA4" FUNCTION="outp10" SIGNAL="DIG" IO="OUT" CONTROL="DATA" POLARITY="P"/>
<PIN PIN_NUM="Y5" FUNCTION="inp3" SIGNAL="DIG" IO="IN" CONTROL="DATA" POLARITY="P"/>
<PIN PIN_NUM="Y6" FUNCTION="inp22" SIGNAL="DIG" IO="IN" CONTROL="DATA" POLARITY="P"/>
<PIN PIN_NUM="AB5" FUNCTION="outp8" SIGNAL="DIG" IO="OUT" CONTROL="DATA" POLARITY="P"/>
<PIN PIN_NUM="AA5" FUNCTION="outp23" SIGNAL="DIG" IO="OUT" CONTROL="DATA" POLARITY="P"/>
<PIN PIN_NUM="Y7" FUNCTION="outp93" SIGNAL="DIG" IO="OUT" CONTROL="DATA" POLARITY="P"/>
<PIN PIN_NUM="U8" FUNCTION="outp14" SIGNAL="DIG" IO="OUT" CONTROL="DATA" POLARITY="P"/>
<PIN PIN_NUM="AB6" FUNCTION="inp0" SIGNAL="DIG" IO="IN" CONTROL="DATA" POLARITY="P"/>
<PIN PIN_NUM="AA6" FUNCTION="inp10" SIGNAL="DIG" IO="IN" CONTROL="DATA" POLARITY="P"/>
<PIN PIN_NUM="V8" FUNCTION="inp20" SIGNAL="DIG" IO="IN" CONTROL="DATA" POLARITY="P"/>
<PIN PIN_NUM="W7" FUNCTION="inp5" SIGNAL="DIG" IO="IN" CONTROL="DATA" POLARITY="P"/>
<PIN PIN_NUM="W8" FUNCTION="inp12" SIGNAL="DIG" IO="IN" CONTROL="DATA" POLARITY="P"/>
<PIN PIN_NUM="V9" FUNCTION="inp27" SIGNAL="DIG" IO="IN" CONTROL="DATA" POLARITY="P"/>
<PIN PIN_NUM="AB7" FUNCTION="inp24" SIGNAL="DIG" IO="IN" CONTROL="DATA" POLARITY="P"/>
<PIN PIN_NUM="AA7" FUNCTION="inp30" SIGNAL="DIG" IO="IN" CONTROL="DATA" POLARITY="P"/>
<PIN PIN_NUM="Y9" FUNCTION="inp103" SIGNAL="DIG" IO="IN" CONTROL="DATA" POLARITY="P"/>
<PIN PIN_NUM="W9" FUNCTION="inp117" SIGNAL="DIG" IO="IN" CONTROL="DATA" POLARITY="P"/>
<PIN PIN_NUM="U9" FUNCTION="inp13" SIGNAL="DIG" IO="IN" CONTROL="DATA" POLARITY="P"/>
<PIN PIN_NUM="U10" FUNCTION="inp16" SIGNAL="DIG" IO="IN" CONTROL="DATA" POLARITY="P"/>
<PIN PIN_NUM="AB8" FUNCTION="inp31" SIGNAL="DIG" IO="IN" CONTROL="DATA" POLARITY="P"/>
<PIN PIN_NUM="AA8" FUNCTION="inp28" SIGNAL="DIG" IO="IN" CONTROL="DATA" POLARITY="P"/>
<PIN PIN_NUM="Y10" FUNCTION="inp93" SIGNAL="DIG" IO="IN" CONTROL="DATA" POLARITY="P"/>
<PIN PIN_NUM="AB9" FUNCTION="inp89" SIGNAL="DIG" IO="IN" CONTROL="DATA" POLARITY="P"/>
<PIN PIN_NUM="AA9" FUNCTION="inp79" SIGNAL="DIG" IO="IN" CONTROL="DATA" POLARITY="P"/>
<PIN PIN_NUM="W11" FUNCTION="inp21" SIGNAL="DIG" IO="IN" CONTROL="DATA" POLARITY="P"/>
<PIN PIN_NUM="V11" FUNCTION="inp14" SIGNAL="DIG" IO="IN" CONTROL="DATA" POLARITY="P"/>
<PIN PIN_NUM="AB10" FUNCTION="inp26" SIGNAL="DIG" IO="IN" CONTROL="DATA" POLARITY="P"/>
<PIN PIN_NUM="AA10" FUNCTION="inp86" SIGNAL="DIG" IO="IN" CONTROL="DATA" POLARITY="P"/>
<PIN PIN_NUM="AB11" FUNCTION="inp123" SIGNAL="DIG" IO="IN" CONTROL="DATA" POLARITY="P"/>
<PIN PIN_NUM="AA11" FUNCTION="inp126" SIGNAL="DIG" IO="IN" CONTROL="DATA" POLARITY="P"/>
<PIN PIN_NUM="U11" FUNCTION="inp106" SIGNAL="DIG" IO="IN" CONTROL="DATA" POLARITY="P"/>
<PIN PIN_NUM="U12" FUNCTION="inp107" SIGNAL="DIG" IO="IN" CONTROL="DATA" POLARITY="P"/>
<PIN PIN_NUM="W12" FUNCTION="inp110" SIGNAL="DIG" IO="IN" CONTROL="DATA" POLARITY="P"/>
<PIN PIN_NUM="V12" FUNCTION="inp111" SIGNAL="DIG" IO="IN" CONTROL="DATA" POLARITY="P"/>
<PIN PIN_NUM="AB12" FUNCTION="inp19" SIGNAL="DIG" IO="IN" CONTROL="DATA" POLARITY="P"/>
<PIN PIN_NUM="AA12" FUNCTION="inp84" SIGNAL="DIG" IO="IN" CONTROL="DATA" POLARITY="P"/>
<PIN PIN_NUM="AB13" FUNCTION="inp113" SIGNAL="DIG" IO="IN" CONTROL="DATA" POLARITY="P"/>
<PIN PIN_NUM="AA13" FUNCTION="inp29" SIGNAL="DIG" IO="IN" CONTROL="DATA" POLARITY="P"/>
<PIN PIN_NUM="U13" FUNCTION="inp83" SIGNAL="DIG" IO="IN" CONTROL="DATA" POLARITY="P"/>
<PIN PIN_NUM="Y13" FUNCTION="inp109" SIGNAL="DIG" IO="IN" CONTROL="DATA" POLARITY="P"/>
<PIN PIN_NUM="AB14" FUNCTION="outp65" SIGNAL="DIG" IO="OUT" CONTROL="DATA" POLARITY="P"/>
<PIN PIN_NUM="AA14" FUNCTION="inp75" SIGNAL="DIG" IO="IN" CONTROL="DATA" POLARITY="P"/>
<PIN PIN_NUM="AB15" FUNCTION="inp114" SIGNAL="DIG" IO="IN" CONTROL="DATA" POLARITY="P"/>
<PIN PIN_NUM="AA15" FUNCTION="inp78" SIGNAL="DIG" IO="IN" CONTROL="DATA" POLARITY="P"/>
<PIN PIN_NUM="AB16" FUNCTION="inp92" SIGNAL="DIG" IO="IN" CONTROL="DATA" POLARITY="P"/>
<PIN PIN_NUM="AA16" FUNCTION="inp85" SIGNAL="DIG" IO="IN" CONTROL="DATA" POLARITY="P"/>
<PIN PIN_NUM="W14" FUNCTION="outp54" SIGNAL="DIG" IO="OUT" CONTROL="DATA" POLARITY="P"/>
<PIN PIN_NUM="V14" FUNCTION="inp118" SIGNAL="DIG" IO="IN" CONTROL="DATA" POLARITY="P"/>
<PIN PIN_NUM="AB17" FUNCTION="inp18" SIGNAL="DIG" IO="IN" CONTROL="DATA" POLARITY="P"/>
<PIN PIN_NUM="AA17" FUNCTION="inp124" SIGNAL="DIG" IO="IN" CONTROL="DATA" POLARITY="P"/>
<PIN PIN_NUM="U14" FUNCTION="inp70" SIGNAL="DIG" IO="IN" CONTROL="DATA" POLARITY="P"/>
<PIN PIN_NUM="Y14" FUNCTION="outp88" SIGNAL="DIG" IO="OUT" CONTROL="DATA" POLARITY="P"/>
<PIN PIN_NUM="W15" FUNCTION="inp104" SIGNAL="DIG" IO="IN" CONTROL="DATA" POLARITY="P"/>
<PIN PIN_NUM="AB18" FUNCTION="outp80" SIGNAL="DIG" IO="OUT" CONTROL="DATA" POLARITY="P"/>
<PIN PIN_NUM="AA18" FUNCTION="outp63" SIGNAL="DIG" IO="OUT" CONTROL="DATA" POLARITY="P"/>
<PIN PIN_NUM="Y16" FUNCTION="outp22" SIGNAL="DIG" IO="OUT" CONTROL="DATA" POLARITY="P"/>
<PIN PIN_NUM="U15" FUNCTION="outp67" SIGNAL="DIG" IO="OUT" CONTROL="DATA" POLARITY="P"/>
<PIN PIN_NUM="V15" FUNCTION="outp59" SIGNAL="DIG" IO="OUT" CONTROL="DATA" POLARITY="P"/>
<PIN PIN_NUM="Y17" FUNCTION="outp66" SIGNAL="DIG" IO="OUT" CONTROL="DATA" POLARITY="P"/>
<PIN PIN_NUM="W16" FUNCTION="outp62" SIGNAL="DIG" IO="OUT" CONTROL="DATA" POLARITY="P"/>
<PIN PIN_NUM="AB19" FUNCTION="outp29" SIGNAL="DIG" IO="OUT" CONTROL="DATA" POLARITY="P"/>
<PIN PIN_NUM="AA19" FUNCTION="" SIGNAL="NC" IO="IN" CONTROL="DATA" POLARITY="P"/>
<PIN PIN_NUM="AB20" FUNCTION="outp17" SIGNAL="DIG" IO="OUT" CONTROL="DATA" POLARITY="P"/>
<PIN PIN_NUM="AA20" FUNCTION="outp87" SIGNAL="DIG" IO="OUT" CONTROL="DATA" POLARITY="P"/>
<PIN PIN_NUM="V16" FUNCTION="" SIGNAL="NC" IO="IN" CONTROL="DATA" POLARITY="P"/>
<PIN PIN_NUM="U16" FUNCTION="" SIGNAL="NC" IO="IN" CONTROL="DATA" POLARITY="P"/>
<PIN PIN_NUM="V18" FUNCTION="" SIGNAL="NC" IO="IN" CONTROL="DATA" POLARITY="P"/>
<PIN PIN_NUM="U17" FUNCTION="" SIGNAL="NC" IO="IN" CONTROL="DATA" POLARITY="P"/>
<PIN PIN_NUM="T17" FUNCTION="" SIGNAL="NC" IO="IN" CONTROL="DATA" POLARITY="P"/>
<PIN PIN_NUM="Y18" FUNCTION="" SIGNAL="NC" IO="IN" CONTROL="DATA" POLARITY="P"/>
<PIN PIN_NUM="V19" FUNCTION="" SIGNAL="NC" IO="IN" CONTROL="DATA" POLARITY="P"/>
<PIN PIN_NUM="W20" FUNCTION="~LVDS142p/nCEO~" SIGNAL="DIG" IO="OUT" CONTROL="DATA" POLARITY="P"/>
<PIN PIN_NUM="Y19" FUNCTION="" SIGNAL="NC" IO="IN" CONTROL="DATA" POLARITY="P"/>
<PIN PIN_NUM="Y20" FUNCTION="" SIGNAL="NC" IO="IN" CONTROL="DATA" POLARITY="P"/>
<PIN PIN_NUM="W18" FUNCTION="" SIGNAL="NC" IO="IN" CONTROL="DATA" POLARITY="P"/>
<PIN PIN_NUM="U18" FUNCTION="inp95" SIGNAL="DIG" IO="IN" CONTROL="DATA" POLARITY="P"/>
<PIN PIN_NUM="T18" FUNCTION="stateModExp4" SIGNAL="DIG" IO="OUT" CONTROL="DATA" POLARITY="P"/>
<PIN PIN_NUM="U19" FUNCTION="inp73" SIGNAL="DIG" IO="IN" CONTROL="DATA" POLARITY="P"/>
<PIN PIN_NUM="V20" FUNCTION="inp62" SIGNAL="DIG" IO="IN" CONTROL="DATA" POLARITY="P"/>
<PIN PIN_NUM="U20" FUNCTION="outp27" SIGNAL="DIG" IO="OUT" CONTROL="DATA" POLARITY="P"/>
<PIN PIN_NUM="W21" FUNCTION="inp53" SIGNAL="DIG" IO="IN" CONTROL="DATA" POLARITY="P"/>
<PIN PIN_NUM="W22" FUNCTION="inp34" SIGNAL="DIG" IO="IN" CONTROL="DATA" POLARITY="P"/>
<PIN PIN_NUM="R17" FUNCTION="inp74" SIGNAL="DIG" IO="IN" CONTROL="DATA" POLARITY="P"/>
<PIN PIN_NUM="Y21" FUNCTION="outp58" SIGNAL="DIG" IO="OUT" CONTROL="DATA" POLARITY="P"/>
<PIN PIN_NUM="Y22" FUNCTION="inp65" SIGNAL="DIG" IO="IN" CONTROL="DATA" POLARITY="P"/>
<PIN PIN_NUM="V21" FUNCTION="outp68" SIGNAL="DIG" IO="OUT" CONTROL="DATA" POLARITY="P"/>
<PIN PIN_NUM="V22" FUNCTION="outp78" SIGNAL="DIG" IO="OUT" CONTROL="DATA" POLARITY="P"/>
<PIN PIN_NUM="U21" FUNCTION="inp98" SIGNAL="DIG" IO="IN" CONTROL="DATA" POLARITY="P"/>
<PIN PIN_NUM="U22" FUNCTION="inp91" SIGNAL="DIG" IO="IN" CONTROL="DATA" POLARITY="P"/>
<PIN PIN_NUM="R18" FUNCTION="inp82" SIGNAL="DIG" IO="IN" CONTROL="DATA" POLARITY="P"/>
<PIN PIN_NUM="R19" FUNCTION="inp36" SIGNAL="DIG" IO="IN" CONTROL="DATA" POLARITY="P"/>
<PIN PIN_NUM="P17" FUNCTION="inp32" SIGNAL="DIG" IO="IN" CONTROL="DATA" POLARITY="P"/>
<PIN PIN_NUM="P18" FUNCTION="inp35" SIGNAL="DIG" IO="IN" CONTROL="DATA" POLARITY="P"/>
<PIN PIN_NUM="T21" FUNCTION="inp61" SIGNAL="DIG" IO="IN" CONTROL="DATA" POLARITY="P"/>
<PIN PIN_NUM="T22" FUNCTION="inp68" SIGNAL="DIG" IO="IN" CONTROL="DATA" POLARITY="P"/>
<PIN PIN_NUM="R21" FUNCTION="inp76" SIGNAL="DIG" IO="IN" CONTROL="DATA" POLARITY="P"/>
<PIN PIN_NUM="R22" FUNCTION="outp38" SIGNAL="DIG" IO="OUT" CONTROL="DATA" POLARITY="P"/>
<PIN PIN_NUM="R20" FUNCTION="inp122" SIGNAL="DIG" IO="IN" CONTROL="DATA" POLARITY="P"/>
<PIN PIN_NUM="P20" FUNCTION="inp23" SIGNAL="DIG" IO="IN" CONTROL="DATA" POLARITY="P"/>
<PIN PIN_NUM="P19" FUNCTION="inp15" SIGNAL="DIG" IO="IN" CONTROL="DATA" POLARITY="P"/>
<PIN PIN_NUM="P21" FUNCTION="inp96" SIGNAL="DIG" IO="IN" CONTROL="DATA" POLARITY="P"/>
<PIN PIN_NUM="P22" FUNCTION="inp87" SIGNAL="DIG" IO="IN" CONTROL="DATA" POLARITY="P"/>
<PIN PIN_NUM="N20" FUNCTION="nSTATUS" SIGNAL="DIG" IO="IN" CONTROL="CNTL" POLARITY="P"/>
<PIN PIN_NUM="N18" FUNCTION="CONF_DONE" SIGNAL="DIG" IO="IN" CONTROL="CNTL" POLARITY="P"/>
<PIN PIN_NUM="N17" FUNCTION="MSEL1" SIGNAL="DIG" IO="IN" CONTROL="CNTL" POLARITY="P"/>
<PIN PIN_NUM="M17" FUNCTION="MSEL0" SIGNAL="DIG" IO="IN" CONTROL="CNTL" POLARITY="P"/>
<PIN PIN_NUM="N21" FUNCTION="inp64" SIGNAL="DIG" IO="IN" CONTROL="DATA" POLARITY="P"/>
<PIN PIN_NUM="N22" FUNCTION="inp41" SIGNAL="DIG" IO="IN" CONTROL="DATA" POLARITY="P"/>
<PIN PIN_NUM="M19" FUNCTION="inp46" SIGNAL="DIG" IO="IN" CONTROL="DATA" POLARITY="P"/>
<PIN PIN_NUM="M18" FUNCTION="outp19" SIGNAL="DIG" IO="OUT" CONTROL="DATA" POLARITY="P"/>
<PIN PIN_NUM="M21" FUNCTION="inp71" SIGNAL="DIG" IO="IN" CONTROL="DATA" POLARITY="P"/>
<PIN PIN_NUM="M22" FUNCTION="inp72" SIGNAL="DIG" IO="IN" CONTROL="DATA" POLARITY="P"/>
<PIN PIN_NUM="L21" FUNCTION="" SIGNAL="NC" IO="IN" CONTROL="DATA" POLARITY="P"/>
<PIN PIN_NUM="L22" FUNCTION="" SIGNAL="NC" IO="IN" CONTROL="DATA" POLARITY="P"/>
<PIN PIN_NUM="L19" FUNCTION="inp47" SIGNAL="DIG" IO="IN" CONTROL="DATA" POLARITY="P"/>
<PIN PIN_NUM="L18" FUNCTION="inp77" SIGNAL="DIG" IO="IN" CONTROL="DATA" POLARITY="P"/>
<PIN PIN_NUM="K21" FUNCTION="outp20" SIGNAL="DIG" IO="OUT" CONTROL="DATA" POLARITY="P"/>
<PIN PIN_NUM="K22" FUNCTION="outp48" SIGNAL="DIG" IO="OUT" CONTROL="DATA" POLARITY="P"/>
<PIN PIN_NUM="J21" FUNCTION="outp24" SIGNAL="DIG" IO="OUT" CONTROL="DATA" POLARITY="P"/>
<PIN PIN_NUM="J22" FUNCTION="outp21" SIGNAL="DIG" IO="OUT" CONTROL="DATA" POLARITY="P"/>
<PIN PIN_NUM="L17" FUNCTION="inp17" SIGNAL="DIG" IO="IN" CONTROL="DATA" POLARITY="P"/>
<PIN PIN_NUM="K17" FUNCTION="inp90" SIGNAL="DIG" IO="IN" CONTROL="DATA" POLARITY="P"/>
<PIN PIN_NUM="H21" FUNCTION="outp33" SIGNAL="DIG" IO="OUT" CONTROL="DATA" POLARITY="P"/>
<PIN PIN_NUM="H22" FUNCTION="inp54" SIGNAL="DIG" IO="IN" CONTROL="DATA" POLARITY="P"/>
<PIN PIN_NUM="K18" FUNCTION="inp49" SIGNAL="DIG" IO="IN" CONTROL="DATA" POLARITY="P"/>
<PIN PIN_NUM="J20" FUNCTION="inp56" SIGNAL="DIG" IO="IN" CONTROL="DATA" POLARITY="P"/>
<PIN PIN_NUM="H19" FUNCTION="outp52" SIGNAL="DIG" IO="OUT" CONTROL="DATA" POLARITY="P"/>
<PIN PIN_NUM="K20" FUNCTION="inp42" SIGNAL="DIG" IO="IN" CONTROL="DATA" POLARITY="P"/>
<PIN PIN_NUM="J19" FUNCTION="outp40" SIGNAL="DIG" IO="OUT" CONTROL="DATA" POLARITY="P"/>
<PIN PIN_NUM="J18" FUNCTION="outp39" SIGNAL="DIG" IO="OUT" CONTROL="DATA" POLARITY="P"/>
<PIN PIN_NUM="J17" FUNCTION="outp72" SIGNAL="DIG" IO="OUT" CONTROL="DATA" POLARITY="P"/>
<PIN PIN_NUM="G21" FUNCTION="outp90" SIGNAL="DIG" IO="OUT" CONTROL="DATA" POLARITY="P"/>
<PIN PIN_NUM="G22" FUNCTION="outp75" SIGNAL="DIG" IO="OUT" CONTROL="DATA" POLARITY="P"/>
<PIN PIN_NUM="F21" FUNCTION="outp71" SIGNAL="DIG" IO="OUT" CONTROL="DATA" POLARITY="P"/>
<PIN PIN_NUM="F22" FUNCTION="outp74" SIGNAL="DIG" IO="OUT" CONTROL="DATA" POLARITY="P"/>
<PIN PIN_NUM="H18" FUNCTION="outp36" SIGNAL="DIG" IO="OUT" CONTROL="DATA" POLARITY="P"/>
<PIN PIN_NUM="H17" FUNCTION="outp64" SIGNAL="DIG" IO="OUT" CONTROL="DATA" POLARITY="P"/>
<PIN PIN_NUM="E21" FUNCTION="inp80" SIGNAL="DIG" IO="IN" CONTROL="DATA" POLARITY="P"/>
<PIN PIN_NUM="E22" FUNCTION="outp97" SIGNAL="DIG" IO="OUT" CONTROL="DATA" POLARITY="P"/>
<PIN PIN_NUM="D21" FUNCTION="outp51" SIGNAL="DIG" IO="OUT" CONTROL="DATA" POLARITY="P"/>
<PIN PIN_NUM="D22" FUNCTION="outp49" SIGNAL="DIG" IO="OUT" CONTROL="DATA" POLARITY="P"/>
<PIN PIN_NUM="G17" FUNCTION="outp70" SIGNAL="DIG" IO="OUT" CONTROL="DATA" POLARITY="P"/>
<PIN PIN_NUM="G18" FUNCTION="outp69" SIGNAL="DIG" IO="OUT" CONTROL="DATA" POLARITY="P"/>
<PIN PIN_NUM="G20" FUNCTION="outp56" SIGNAL="DIG" IO="OUT" CONTROL="DATA" POLARITY="P"/>
<PIN PIN_NUM="E20" FUNCTION="outp92" SIGNAL="DIG" IO="OUT" CONTROL="DATA" POLARITY="P"/>
<PIN PIN_NUM="F20" FUNCTION="" SIGNAL="NC" IO="IN" CONTROL="DATA" POLARITY="P"/>
<PIN PIN_NUM="C21" FUNCTION="outp98" SIGNAL="DIG" IO="OUT" CONTROL="DATA" POLARITY="P"/>
<PIN PIN_NUM="C22" FUNCTION="" SIGNAL="NC" IO="IN" CONTROL="DATA" POLARITY="P"/>
<PIN PIN_NUM="C19" FUNCTION="" SIGNAL="NC" IO="IN" CONTROL="DATA" POLARITY="P"/>
<PIN PIN_NUM="C20" FUNCTION="" SIGNAL="NC" IO="IN" CONTROL="DATA" POLARITY="P"/>
<PIN PIN_NUM="D19" FUNCTION="" SIGNAL="NC" IO="IN" CONTROL="DATA" POLARITY="P"/>
<PIN PIN_NUM="D20" FUNCTION="" SIGNAL="NC" IO="IN" CONTROL="DATA" POLARITY="P"/>
<PIN PIN_NUM="E19" FUNCTION="" SIGNAL="NC" IO="IN" CONTROL="DATA" POLARITY="P"/>
<PIN PIN_NUM="E18" FUNCTION="" SIGNAL="NC" IO="IN" CONTROL="DATA" POLARITY="P"/>
<PIN PIN_NUM="F18" FUNCTION="" SIGNAL="NC" IO="IN" CONTROL="DATA" POLARITY="P"/>
<PIN PIN_NUM="F17" FUNCTION="" SIGNAL="NC" IO="IN" CONTROL="DATA" POLARITY="P"/>
<PIN PIN_NUM="E17" FUNCTION="" SIGNAL="NC" IO="IN" CONTROL="DATA" POLARITY="P"/>
<PIN PIN_NUM="F16" FUNCTION="" SIGNAL="NC" IO="IN" CONTROL="DATA" POLARITY="P"/>
<PIN PIN_NUM="E16" FUNCTION="" SIGNAL="NC" IO="IN" CONTROL="DATA" POLARITY="P"/>
<PIN PIN_NUM="C18" FUNCTION="outp43" SIGNAL="DIG" IO="OUT" CONTROL="DATA" POLARITY="P"/>
<PIN PIN_NUM="C17" FUNCTION="outp102" SIGNAL="DIG" IO="OUT" CONTROL="DATA" POLARITY="P"/>
<PIN PIN_NUM="B20" FUNCTION="outp83" SIGNAL="DIG" IO="OUT" CONTROL="DATA" POLARITY="P"/>
<PIN PIN_NUM="A20" FUNCTION="outp79" SIGNAL="DIG" IO="OUT" CONTROL="DATA" POLARITY="P"/>
<PIN PIN_NUM="B19" FUNCTION="outp60" SIGNAL="DIG" IO="OUT" CONTROL="DATA" POLARITY="P"/>
<PIN PIN_NUM="A19" FUNCTION="outp53" SIGNAL="DIG" IO="OUT" CONTROL="DATA" POLARITY="P"/>
<PIN PIN_NUM="B18" FUNCTION="outp61" SIGNAL="DIG" IO="OUT" CONTROL="DATA" POLARITY="P"/>
<PIN PIN_NUM="A18" FUNCTION="outp85" SIGNAL="DIG" IO="OUT" CONTROL="DATA" POLARITY="P"/>
<PIN PIN_NUM="C16" FUNCTION="outp32" SIGNAL="DIG" IO="OUT" CONTROL="DATA" POLARITY="P"/>
<PIN PIN_NUM="D16" FUNCTION="outp86" SIGNAL="DIG" IO="OUT" CONTROL="DATA" POLARITY="P"/>
<PIN PIN_NUM="E15" FUNCTION="outp35" SIGNAL="DIG" IO="OUT" CONTROL="DATA" POLARITY="P"/>
<PIN PIN_NUM="D15" FUNCTION="outp73" SIGNAL="DIG" IO="OUT" CONTROL="DATA" POLARITY="P"/>
<PIN PIN_NUM="C14" FUNCTION="outp34" SIGNAL="DIG" IO="OUT" CONTROL="DATA" POLARITY="P"/>
<PIN PIN_NUM="F15" FUNCTION="outp26" SIGNAL="DIG" IO="OUT" CONTROL="DATA" POLARITY="P"/>
<PIN PIN_NUM="B17" FUNCTION="outp30" SIGNAL="DIG" IO="OUT" CONTROL="DATA" POLARITY="P"/>
<PIN PIN_NUM="A17" FUNCTION="outp31" SIGNAL="DIG" IO="OUT" CONTROL="DATA" POLARITY="P"/>
<PIN PIN_NUM="E14" FUNCTION="outp50" SIGNAL="DIG" IO="OUT" CONTROL="DATA" POLARITY="P"/>
<PIN PIN_NUM="D14" FUNCTION="outp41" SIGNAL="DIG" IO="OUT" CONTROL="DATA" POLARITY="P"/>
<PIN PIN_NUM="F14" FUNCTION="outp42" SIGNAL="DIG" IO="OUT" CONTROL="DATA" POLARITY="P"/>
<PIN PIN_NUM="F13" FUNCTION="outp57" SIGNAL="DIG" IO="OUT" CONTROL="DATA" POLARITY="P"/>
<PIN PIN_NUM="B16" FUNCTION="outp46" SIGNAL="DIG" IO="OUT" CONTROL="DATA" POLARITY="P"/>
<PIN PIN_NUM="A16" FUNCTION="outp45" SIGNAL="DIG" IO="OUT" CONTROL="DATA" POLARITY="P"/>
<PIN PIN_NUM="B15" FUNCTION="outp44" SIGNAL="DIG" IO="OUT" CONTROL="DATA" POLARITY="P"/>
<PIN PIN_NUM="A15" FUNCTION="outp47" SIGNAL="DIG" IO="OUT" CONTROL="DATA" POLARITY="P"/>
<PIN PIN_NUM="C13" FUNCTION="outp55" SIGNAL="DIG" IO="OUT" CONTROL="DATA" POLARITY="P"/>
<PIN PIN_NUM="F12" FUNCTION="inp38" SIGNAL="DIG" IO="IN" CONTROL="DATA" POLARITY="P"/>
<PIN PIN_NUM="B14" FUNCTION="inp48" SIGNAL="DIG" IO="IN" CONTROL="DATA" POLARITY="P"/>
<PIN PIN_NUM="A14" FUNCTION="outp25" SIGNAL="DIG" IO="OUT" CONTROL="DATA" POLARITY="P"/>
<PIN PIN_NUM="B13" FUNCTION="outp76" SIGNAL="DIG" IO="OUT" CONTROL="DATA" POLARITY="P"/>
<PIN PIN_NUM="A13" FUNCTION="inp59" SIGNAL="DIG" IO="IN" CONTROL="DATA" POLARITY="P"/>
<PIN PIN_NUM="B12" FUNCTION="" SIGNAL="NC" IO="IN" CONTROL="DATA" POLARITY="P"/>
<PIN PIN_NUM="A12" FUNCTION="" SIGNAL="NC" IO="IN" CONTROL="DATA" POLARITY="P"/>
<PIN PIN_NUM="D12" FUNCTION="" SIGNAL="NC" IO="IN" CONTROL="DATA" POLARITY="P"/>
<PIN PIN_NUM="E12" FUNCTION="" SIGNAL="NC" IO="IN" CONTROL="DATA" POLARITY="P"/>
<PIN PIN_NUM="B11" FUNCTION="inp37" SIGNAL="DIG" IO="IN" CONTROL="DATA" POLARITY="P"/>
<PIN PIN_NUM="A11" FUNCTION="inp45" SIGNAL="DIG" IO="IN" CONTROL="DATA" POLARITY="P"/>
<PIN PIN_NUM="E11" FUNCTION="inp67" SIGNAL="DIG" IO="IN" CONTROL="DATA" POLARITY="P"/>
<PIN PIN_NUM="D11" FUNCTION="inp50" SIGNAL="DIG" IO="IN" CONTROL="DATA" POLARITY="P"/>
<PIN PIN_NUM="B10" FUNCTION="inp55" SIGNAL="DIG" IO="IN" CONTROL="DATA" POLARITY="P"/>
<PIN PIN_NUM="A10" FUNCTION="outp37" SIGNAL="DIG" IO="OUT" CONTROL="DATA" POLARITY="P"/>
<PIN PIN_NUM="F11" FUNCTION="inp43" SIGNAL="DIG" IO="IN" CONTROL="DATA" POLARITY="P"/>
<PIN PIN_NUM="F10" FUNCTION="inp58" SIGNAL="DIG" IO="IN" CONTROL="DATA" POLARITY="P"/>
<PIN PIN_NUM="C10" FUNCTION="inp25" SIGNAL="DIG" IO="IN" CONTROL="DATA" POLARITY="P"/>
<PIN PIN_NUM="B9" FUNCTION="inp39" SIGNAL="DIG" IO="IN" CONTROL="DATA" POLARITY="P"/>
<PIN PIN_NUM="A9" FUNCTION="inp33" SIGNAL="DIG" IO="IN" CONTROL="DATA" POLARITY="P"/>
<PIN PIN_NUM="E9" FUNCTION="inp44" SIGNAL="DIG" IO="IN" CONTROL="DATA" POLARITY="P"/>
<PIN PIN_NUM="D9" FUNCTION="inp40" SIGNAL="DIG" IO="IN" CONTROL="DATA" POLARITY="P"/>
<PIN PIN_NUM="B8" FUNCTION="inp97" SIGNAL="DIG" IO="IN" CONTROL="DATA" POLARITY="P"/>
<PIN PIN_NUM="A8" FUNCTION="inp63" SIGNAL="DIG" IO="IN" CONTROL="DATA" POLARITY="P"/>
<PIN PIN_NUM="B7" FUNCTION="inp57" SIGNAL="DIG" IO="IN" CONTROL="DATA" POLARITY="P"/>
<PIN PIN_NUM="A7" FUNCTION="inp51" SIGNAL="DIG" IO="IN" CONTROL="DATA" POLARITY="P"/>
<PIN PIN_NUM="F9" FUNCTION="inp81" SIGNAL="DIG" IO="IN" CONTROL="DATA" POLARITY="P"/>
<PIN PIN_NUM="E8" FUNCTION="inp11" SIGNAL="DIG" IO="IN" CONTROL="DATA" POLARITY="P"/>
<PIN PIN_NUM="D8" FUNCTION="outp18" SIGNAL="DIG" IO="OUT" CONTROL="DATA" POLARITY="P"/>
<PIN PIN_NUM="C9" FUNCTION="outp101" SIGNAL="DIG" IO="OUT" CONTROL="DATA" POLARITY="P"/>
<PIN PIN_NUM="D7" FUNCTION="outp77" SIGNAL="DIG" IO="OUT" CONTROL="DATA" POLARITY="P"/>
<PIN PIN_NUM="F8" FUNCTION="outp12" SIGNAL="DIG" IO="OUT" CONTROL="DATA" POLARITY="P"/>
<PIN PIN_NUM="E7" FUNCTION="outp91" SIGNAL="DIG" IO="OUT" CONTROL="DATA" POLARITY="P"/>
<PIN PIN_NUM="C7" FUNCTION="outp94" SIGNAL="DIG" IO="OUT" CONTROL="DATA" POLARITY="P"/>
<PIN PIN_NUM="B6" FUNCTION="outp81" SIGNAL="DIG" IO="OUT" CONTROL="DATA" POLARITY="P"/>
<PIN PIN_NUM="A6" FUNCTION="outp9" SIGNAL="DIG" IO="OUT" CONTROL="DATA" POLARITY="P"/>